1st_deponent,muner,"give, present;"
1st_deponent,musin,deliberate about;
1st_deponent,mutu,"borrow, obtain on loan;"
1st_deponent,negoti,"do business, trade;"
1st_deponent,nix,"support oneself, rest/lean (on) (w/ABL); struggle/strive, exert oneself (W/INF);"
1st_deponent,nug,"play the fool, talk nonsense; trifle;"
1st_deponent,nundin,buy or sell in the market; practice trade of a discreditable kind;
1st_deponent,nutric,nurse/suckle; raise/rear/bring up; nourish/promote growth/well being; cherish;
1st_deponent,obluct,struggle against;
1st_deponent,obson,"buy food, get/purchase provisions/(things for meal); go shopping; feast/banquet;"
1st_deponent,obtest,call to witness; implore;
1st_deponent,obvers,appear before one; go to and fro publicly;
1st_deponent,odor,"smell out, scent; get a smattering (of );"
1st_deponent,omin,"forebode, presage;"
1st_deponent,oper,"labor, toil, work; perform (religious service), attend, serve; devote oneself;"
1st_deponent,opin,"suppose, imagine;"
1st_deponent,opitul,bring aid to; help; bring relief to;
1st_deponent,opson,"buy food, get/purchase provisions/(things for meal); go shopping; feast/banquet;"
1st_deponent,ort,procreate; give birth/rise to; beget; engender/produce/generate (offspring);
1st_deponent,oscul,kiss; exchange kisses;
1st_deponent,oti,"be at leisure, enjoy a holiday;"
1st_deponent,pabul,forage;
1st_deponent,pal,wander abroad stray; scatter; wander aimlessly;
1st_deponent,palp,"stroke; coax, flatter, wheedle;"
1st_deponent,pandicul,stretch oneself;
1st_deponent,patrocin,"defend, protect;"
1st_deponent,perbacch,get through; waste (time) in revelry; carouse/revel throughout (L+S);
1st_deponent,percont,inquire;
1st_deponent,peregrin,"travel about, be an alien, sojourn in strange country, go abroad, wander, roam;"
1st_deponent,pergraec,enjoy oneself; behave like the Greeks;
1st_deponent,periclit,"try, prove, test, make a trial of, put to the test/in peril; risk, endanger;"
1st_deponent,perplex,perplex;
1st_deponent,perpopul,"ravage, devastate completely;"
1st_deponent,perscrut,search/look though; search high and low; study/investigate carefully;
1st_deponent,persect,pursue/follow closely/eagerly; follow up; investigate (question);
1st_deponent,perspecul,reconnoiter; examine well;
1st_deponent,pervag,"wander or range through, rove about; pervade, spread widely; extend;"
1st_deponent,perven,chase through;
1st_deponent,phantasi,"imagine, fancy;"
1st_deponent,philosoph,philosophize;
1st_deponent,pigner,"appropriate; assert one's claim to; make certain, assure; guarantee, pledge;"
1st_deponent,pignor,"appropriate; assert one's claim to; make certain, assure; guarantee, pledge;"
1st_deponent,pigr,hesitate; hang back;
1st_deponent,pisc,fish;
1st_deponent,pollicit,promise (assiduously);
1st_deponent,popul,"ravage, devastate, lay waste; plunder; despoil, strip;"
1st_deponent,praecon,herald; proclaim;
1st_deponent,praed,acquire loot (by robbery/war/depredation); obtain food by hunting/preying;
1st_deponent,praed,"|pillage, despoil; plunder, loot; take as prey/catch;"
1st_deponent,praef,say/utter/mention beforehand/in advance; recite (preliminary formula);
1st_deponent,praeli,do battle; (variant of proelior);
1st_deponent,praemedit,consider in advance;
1st_deponent,praestol,"stand ready for, expect, wait for (w/DAT or ACC);"
1st_deponent,praevaric,"transgress, sin against; violate; be in collusion; be/walk crooked/not upright;"
1st_deponent,praevaric,|straddle; have secret understanding w/enemy;
1st_deponent,prec,"beg/implore/entreat; wish/pray for/to; pray, supplicate, beseech;"
1st_deponent,princip,rule; rule over (w/GEN/DAT) (Souter);
1st_deponent,proc,"urge/press (w/commands/suits); woo, importune for one's hand; ask/demand (L+S);"
1st_deponent,proeli,fight;
1st_deponent,prof,speak out;
1st_deponent,prooemi,make a prooemium/preface/introduction to a speech;
1st_deponent,prospecul,"look out, survey the situation; look out/watch for;"
1st_deponent,protest,"testify, testify publicly, bear witness to; protest (L+S); assert (Bee);"
1st_deponent,quadrupl,be informer;
1st_deponent,querit,"complain; make a public outcry, cry out in protest; complain excessively;"
1st_deponent,quirit,"complain; make a public outcry, cry out in protest; complain excessively;"
1st_deponent,radi,"beam, shine; radiate light;"
1st_deponent,ratiocin,"compute, calculate; argue, infer, conclude;"
1st_deponent,record,"think over; call to mind, remember;"
1st_deponent,redic,take root; grow roots;
1st_deponent,refrag,"oppose (candidate/interests); act to disadvantage of; act counter to, mitigate;"
1st_deponent,reluct,"resist, struggle against, make opposition;"
1st_deponent,remor,delay;
1st_deponent,remuner,"reward, repay, recompense, remunerate; requite; pay back, retaliate;"
1st_deponent,restipul,demand (from the stipulator) a counter-guarantee; (w/ACC of thing guaranteed);
1st_deponent,rim,"probe, search; rummage about for, examine, explore;"
1st_deponent,rix,"quarrel violently, brawl, dispute;"
1st_deponent,ruct,belch;
1st_deponent,rumin,chew over again; chew the cud;
1st_deponent,rur,live in the country;
1st_deponent,rustic,live in the country;
1st_deponent,savi,kiss;
1st_deponent,sciscit,ask; question; consult;
1st_deponent,scit,"inquire, ask;"
1st_deponent,scort,consort with harlots/prostitutes; act like a harlot/promiscuously;
1st_deponent,scrutin,investigate; examine closely/strictly; scrutinize;
1st_deponent,scrut,search/probe/examine carefully/thoroughly; explore/scan/scrutinize/investigate;
1st_deponent,scurr,"play the ""man about town""; dine off one's jokes;"
1st_deponent,sect,follow continually; pursue; pursue with punishment; hunt out; run after;
1st_deponent,sermocin,"converse, talk, discuss;"
1st_deponent,sol,"solace, console, comfort; soothe, ease, lighten, relieve, assuage, mitigate;"
1st_deponent,spati,"walk; take a walk, promenade; spread;"
1st_deponent,specul,"watch, observe; spy out; examine, explore;"
1st_deponent,stipul,extract solemn promise/guarantee (oral contract); promise in a stipulatio;
1st_deponent,stomach,"be angry, boil with rage;"
1st_deponent,suffrag,"express public support (for), canvass/vote for; lend support (to), favor;"
1st_deponent,suppalp,caress; coax gently;
1st_deponent,supparasit,flatter somewhat;
1st_deponent,suppeti,"help, assist;"
1st_deponent,suspic,"mistrust, suspect; suppose;"
1st_deponent,sycophant,cheat;
1st_deponent,taedi,be sad; be tired/weary/sick (of);
1st_deponent,tergivers,turn one's back on a task or challenge; hang back;
1st_deponent,testific,"assert solemnly, testify (to a fact); demonstrate; invoke as a witness;"
1st_deponent,test,give as evidence; bear witness; make a will; swear; testify;
1st_deponent,tric,behave in evasive manner; trifle/delay/dally; cause trouble; pull/play tricks;
1st_deponent,trist,be sad/grieved/downcast/dejected;
1st_deponent,tuburcin,eat greedily (Plautus);
1st_deponent,tumultu,"make a commotion/disturbance/armed rising; scrap, scrimmage; be in confusion;"
1st_deponent,tu,"see, look at; protect, watch; uphold; (form of tueor);"
1st_deponent,tut,"guard, protect, defend; guard against, avert;"
1st_deponent,urin,"dive, plunge into water;"
1st_deponent,usit,make usual/common/habitual use of; use everyday;
1st_deponent,vad,accept sureties from (the other party) for his appearance in court;
1st_deponent,vag,"wander, roam;"
1st_deponent,vaticin,"prophesy; utter inspired predictions/warnings; rave, talk wildly;"
1st_deponent,velific,"sail (ship); operate sails; set/direct course; direct effort towards, work for;"
1st_deponent,velit,skirmish; fight like light troops (velites);
1st_deponent,vener,"adore, revere, do homage to, honor, venerate; worship; beg, pray, entreat;"
1st_deponent,ven,hunt;
1st_deponent,verecund,show modesty/restraint; be shy/diffident (of doing w/inf); feel bashful/ashamed;
1st_deponent,vers,"move about; live, dwell; be;"
1st_deponent,virid,become green;
1st_deponent,vocifer,"utter a loud cry, shout, yell, cry out, announce loudly;"
