1st	dissec	dissect;	present_stem
1st	dissec	"cut apart; cut in pieces; dismember, dissect;"	present_stem
3rd	dissec	"divide; penetrate through; open by force; dismember, dissect;"	present_stem
4th	disseis	disseise; dispossess; put out of seisin/possession (usu. wrongfully); oust;	present_stem
1st	dissemin	"broadcast, disseminate;"	present_stem
4th	dissent	"dissent, disagree; differ;"	present_stem
3rd	disser	"unfasten, unbar; unlock;"	present_stem
3rd	disser	"plant/sow at intervals; scatter/distribute, plant here/there; separate/part;"	present_stem
3rd	disser	"arrange, dispose, set in order; discuss; examine; explain, set out in words;"	present_stem
3rd	disser	"plant/sow at intervals; scatter/distribute, plant here/there; separate/part;"	present_stem
1st	disseren	it is clearing up all round; (of the weather);	present_stem
1st	dissert	discuss;	present_stem
1st	dissic	"cut apart; cut in pieces; dismember, dissect;"	present_stem
3IO	dissic	"break up; scatter; drive apart; separate into two halves, halve, divide;"	present_stem
3IO	dissic	"|ruin; destroy; rout; disperse; squander; frustrate; dispel, end;"	present_stem
2nd	dissid	"disagree, be at variance; be separated;"	present_stem
1st	dissign	"mark; point/mark/trace out, outline/describe; indicate/designate/denote;"	present_stem
1st	dissign	"|earmark/choose; appoint, elect (magistrate); order/plan; scheme. perpetrate;"	present_stem
1st	dissil	be torn apart;	present_stem
4th	dissil	fly/leap/burst apart; break up; be broken up; burst; split;	present_stem
1st	dissimul	"conceal, dissemble, disguise, hide; ignore;"	present_stem
1st	dissip	"scatter, disperse, dissipate, squander; destroy completely; circulate;"	present_stem
1st	dissoci	"be/set at variance with, split into factions, separate, part;"	present_stem
3rd	dissolv	"unloose; dissolve, destroy; melt; pay; refute; annul;"	present_stem
3rd	dissu	"unstitch, undo the stitches of; rip apart, sever;"	present_stem
2nd	dissuad	"dissuade, advise against;"	present_stem
3rd	dissuesc	"forget, unlearn, become disaccustomed to; disaccustom (person);"	present_stem
1st	dissult	fly or burst apart; bounce off;	present_stem
1st	dissup	"scatter, squander; destroy completely; circulate; (alt. form of dissipo);"	present_stem
1st	dist	"stand apart, be distant; be different;"	present_stem
3rd	distabesc	waste away;	present_stem
3rd	distend	"stretch (apart); spread out; distend; extend; rack; detract, perplex;"	present_stem
3rd	distenn	"stretch (apart); spread out; distend; extend; rack; detract, perplex;"	present_stem
1st	distermin	"divide from, serve as boundary; divide up; mark off w/boundary; separate from;"	present_stem
1st	distill	drip/trickle down; wet/sprinkle; distill; have dripping off; fall bit by bit;	present_stem
1st	distimul	goad hard/on; stimulate (L+S);	present_stem
2nd	distin	"keep apart, separate; prevent, hold up; distract;"	present_stem
3rd	distingu	"distinguish, separate, divide, part; adorn, decorate;"	present_stem
2nd	distorqu	twist this way and that;	present_stem
3rd	distrah	"draw/pull/tear apart, wrench, separate, (sub)divide; sell in parcels; distract;"	present_stem
3rd	distribu	"divide, distribute, assign;"	present_stem
3rd	distring	stretch out/apart; detain; distract; pull in different directions;	present_stem
1st	disturb	"disturb, demolish, upset;"	present_stem
1st	dit	enrich;	present_stem
3rd	ditesc	grow rich;	present_stem
1st	ditt	repeat; declare;	present_stem
1st	divaric	"stretch apart, spread out;"	present_stem
3rd	divell	"alienate/estrange; compel (persons) to part company, force away; separate from;"	present_stem
3rd	divell	"|tear away/open/apart, tear to pieces/in two; break up, sunder/disrupt; divide;"	present_stem
3rd	divell	"alienate/estrange; compel (persons) to part company, force away; separate from;"	present_stem
3rd	divell	"|tear away/open/apart, tear to pieces/in two; break up, sunder/disrupt; divide;"	present_stem
3rd	divell	"alienate/estrange; compel (persons) to part company, force away; separate from;"	present_stem
3rd	divell	"|tear away/open/apart, tear to pieces/in two; break up, sunder/disrupt; divide;"	present_stem
3rd	divend	sell in small lots/retail; sell out;	present_stem
1st	diverber	split; strike violently;	present_stem
2nd	diverg	diverge;	present_stem
3rd	diverr	sweep away; sweep out (L+S);	present_stem
1st	divers	turn around; diversify;	present_stem
1st	diversific	"vary, be different; diversify;"	present_stem
3rd	divert	"separate; divert, turn away/in; digress; oppose; divorce/leave marriage;"	present_stem
1st	divex	drag about; pull this way and that; harass/harry/vex/trouble;	present_stem
1st	divex	"|ravage/plunder; tear/rend/pull/rip apart/asunder, destroy (L+S);"	present_stem
3rd	divid	"divide; separate, break up; share, distribute; distinguish;"	present_stem
1st	divin	divine; prophesy; guess;	present_stem
3rd	divort	"separate; divert, turn away/in; digress; oppose; divorce/leave marriage;"	present_stem
1st	divulg	"publish, disseminate news of;"	present_stem
2nd	doc	"teach, show, point out;"	present_stem
1st	dogmatiz	propound a dogma; dogmatize(Latham);	present_stem
1st	dol	"hew/chop into shape, fashion/devise; inflict blows, batter/cudgel soundly, drub;"	present_stem
2nd	dol	hurt; feel/suffer pain; grieve; be afflicted/pained/sorry; cause pain/grief;	present_stem
1st	dom	"subdue, master, tame; conquer;"	present_stem
1st	domit	"tame, break in;"	present_stem
1st	don	"present, grant; forgive; give (gifts), bestow;"	present_stem
4th	dorm	"sleep, rest; be/fall asleep; behave as if asleep; be idle, do nothing;"	present_stem
1st	dormit	"feel sleepy, drowsy; do nothing;"	present_stem
1st	dot	"provide with a dowry, endow;"	present_stem
1st	dubit	doubt; deliberate; hesitate (over); be uncertain/irresolute;	present_stem
3rd	duc	"lead, command; think, consider, regard; prolong;"	present_stem
1st	duct	lead;	present_stem
1st	duell	duel;	present_stem
1st	dulc	sweeten;	present_stem
3rd	dulcesc	become sweet;	present_stem
1st	dulcor	sweeten;	present_stem
1st	duplic	"double, bend double; duplicate; enlarge;"	present_stem
1st	dur	"harden, make hard; become hard/stern; bear, last, remain, continue; endure;"	present_stem
1st	e	"go, walk; march, advance; pass; flow; pass (time); ride; be in the middle;"	present_stem
3rd	ebib	"drink up, drain; absorb; squander;"	present_stem
1st	ebull	spout out; chatter about; burst/break/send out; [animam ~ => expire];	present_stem
1st	ebull	|bubble; boil-up; produce in abundance;	present_stem
4th	ebull	spout out; chatter about; burst/break/send out; [animam ~ => expire];	present_stem
4th	ebull	|bubble; boil-up; produce in abundance;	present_stem
3rd	ecflor	blossom forth; burst into flower; bloom (Ecc); flourish;	present_stem
3rd	ecfloresc	blossom forth; burst into flower; bloom (Ecc); flourish;	present_stem
3IO	ecfug	"flee/escape; run/slip/keep away (from), eschew/avoid; baffle, escape notice;"	present_stem
3rd	ecfund	pour out/away/off; allow to drain; shower; volley (missiles); send/stream forth;	present_stem
3rd	ecfund	"|shed (blood/tears); discharge (vomit/urine), debouch, emit; flow out, overflow;"	present_stem
3rd	ecfund	"||break out; bear/yield/bring forth; expend/use up; unseat, eject/drop/discard;"	present_stem
3rd	ecfund	"|||stretch/spread out, extend; spread (sail); loosen/slacken/fling, give rein;"	present_stem
1st	ed	eject/emit; put/give forth (buds); beget; bear (fruit); display/evince/exhibit;	present_stem
1st	ed	|utter solemnly; pronounce/decree (oracle); deliver (message); issue (command);	present_stem
1st	ed	"||publish; disclose, tell, relate, make known; declare, make formal statement;"	present_stem
1st	ed	|||cause; see birth of; be birthplace/breeding ground of; debouch (river PASS);	present_stem
1st	ed	"||||bring forth,  produce/yield (crops), give birth to (often PASS PERF VPAR);"	present_stem
1st	ed	|||||notify of suit; nominate for jury; appoint/set (a time); bring witnesses;	present_stem
1st	ed	||||||present (documents for inspection; put on (play); hold (banquet); uplift;	present_stem
3rd	ed	eat/consume/devour; eat away (fire/water/disease); destroy; spend money on food;	present_stem
3rd	ed	eat/consume/devour; eat away (fire/water/disease); destroy; spend money on food;	present_stem
3rd	edic	"proclaim, declare; appoint;"	present_stem
3rd	edisc	learn by heart; commit to memory; study; get to know;	present_stem
3rd	edisser	"set forth in full, relate at length, dwell upon; unfold, explain, tell;"	present_stem
1st	edissert	"relate, expound; explain;"	present_stem
2nd	edoc	teach or inform thoroughly;	present_stem
1st	edol	"hack, hew, hew out; form by hacking; plane (Ecc);"	present_stem
1st	edom	"subdue/tame thoroughly/completely, subjugate/conquer/vanquish;"	present_stem
1st	edom	|master (vices); overcome (difficulties); bring (land /plants)under cultivation;	present_stem
4th	edorm	"sleep, sleep off;"	present_stem
3rd	edormisc	sleep away/through/off; sleep ones fill;	present_stem
1st	educ	bring up; train; educate; rear;	present_stem
3rd	educ	lead out; draw up; bring up; rear;	present_stem
1st	edulcor	sweeten;	present_stem
4th	effarc	stuff full;	present_stem
1st	effemin	"weaken, enervate, make effeminate, emasculate, unman;"	present_stem
1st	effer	make wild/savage/barbaric; brutalize; exasperate;	present_stem
4th	efferc	stuff full;	present_stem
3rd	efferv	boil up or over; swarm forth;	present_stem
3rd	effervesc	"boil up, seethe; effervesce; become greatly excited;"	present_stem
3IO	effic	"bring about; effect, execute, cause; accomplish; make, produce; prove;"	present_stem
1st	effigi	form; fashion; portray;	present_stem
3rd	effing	"fashion, form, mold; represent, portray, depict; copy; wipe away;"	present_stem
1st	effl	blow or breathe out; breathe ones last;	present_stem
1st	efflagit	"request, demand, insist, ask urgently;"	present_stem
3rd	efflig	destroy;	present_stem
3rd	efflor	blossom forth; burst into flower; bloom (Ecc); flourish;	present_stem
3rd	effloresc	blossom forth; burst into flower; bloom (Ecc); flourish;	present_stem
3rd	efflu	"flow out, flow forth; disappear, vanish, escape; be forgotten;"	present_stem
3IO	effod	"dig out, excavate; gouge out;"	present_stem
1st	efform	"form, shape, fashion;"	present_stem
1st	effren	"unbridle, let loose; remove or slacken the reins of a horse;"	present_stem
3rd	effring	break open; smash; break in;	present_stem
1st	effug	"drive away (from); frighten off, deter; drive/send into exile;"	present_stem
3IO	effug	"flee/escape; run/slip/keep away (from), eschew/avoid; baffle, escape notice;"	present_stem
2nd	effulg	"shine forth, glitter; be or become conspicuous;"	present_stem
3rd	effund	pour out/away/off; allow to drain; shower; volley (missiles); send/stream forth;	present_stem
3rd	effund	"|shed (blood/tears); discharge (vomit/urine), debouch, emit; flow out, overflow;"	present_stem
3rd	effund	"||break out; bear/yield/bring forth; expend/use up; unseat, eject/drop/discard;"	present_stem
3rd	effund	"|||stretch/spread out, extend; spread (sail); loosen/slacken/fling, give rein;"	present_stem
4th	effut	"blurt out; blab, babble, prate, chatter; utter foolishly/irresponsibly;"	present_stem
4th	effutt	"blurt out; blab, babble, prate, chatter; utter foolishly/irresponsibly;"	present_stem
3rd	effutu	wear out with sexual intercourse; squander on debauchery;	present_stem
2nd	eg	"need (w/GEN/ABL), lack, want; require, be without;"	present_stem
3rd	eger	"carry or bear out, discharge, utter;"	present_stem
3IO	eic	"accomplish, perform, bring about, cause;"	present_stem
3IO	eic	"cast/throw/fling/drive out/up, extract, expel, discharge, vomit; out (tongue);"	present_stem
1st	eier	"refuse upon/reject by oath; abjure, resign, abdicate, renounce;"	present_stem
1st	eject	cast out;	present_stem
3IO	ejic	"cast/throw/fling/drive out/up, extract, expel, discharge, vomit; out (tongue);"	present_stem
1st	ejul	"wail, lament;"	present_stem
1st	ejur	"abjure; resign; reject on oath (of a judge); forswear, disown;"	present_stem
1st	elabor	"take pains, exert oneself; bestow care on;"	present_stem
3rd	elanguesc	"begin to lose ones vigor, droop, flag; slacken, relax;"	present_stem
4th	elarg	"bestow freely upon; give out, distribute (Ecc);"	present_stem
1st	electrific	electrify;	present_stem
1st	electris	charge;	present_stem
1st	elev	"lift up, raise; alleviate; lessen; make light of;"	present_stem
3IO	elic	"draw/pull out/forth, entice, elicit, coax;"	present_stem
3rd	elid	strike or dash out; expel; shatter; crush out; strangle; destroy;	present_stem
3rd	elig	"pick out, choose;"	present_stem
1st	elim	make/remove by filing; polish w/file; file off; produce/write w/care/polish;	present_stem
1st	elimin	carry out of doors; [w/dicta => to blab];	present_stem
3rd	eling	lick clean; lick up (Ecc);	present_stem
1st	eliqu	refine (an industrial product);	present_stem
1st	elong	"withdraw, depart; remove; keep aloof;"	present_stem
1st	elonginqu	remove;	present_stem
3rd	elu	"wash clean; wash away, clear oneself (of);"	present_stem
2nd	eluc	shine forth; show itself; be manifest;	present_stem
3rd	elucesc	begin to be light; shine forth (Erasmus);	present_stem
1st	elucid	light; enlighten;	present_stem
3rd	elud	"elude, escape from; parry; baffle; cheat; frustrate; mock, make fun of;"	present_stem
3rd	em	"buy; gain, acquire, obtain;"	present_stem
1st	emacul	"cleanse of stains/spots, make clean; heal; correct/clear from faults (Erasmus);"	present_stem
1st	eman	"flow out; arise, emanate from, become known;"	present_stem
2nd	eman	stay away (from); stay out/beyond; absent oneself;	present_stem
1st	emancip	emancipate (son from his fathers authority); alienate; make subservient;	present_stem
2nd	emarc	"decay, wither;"	present_stem
3rd	emarcesc	shrink/decay/wither/dwindle/pine away; disappear (L+S); [~ cor meum => fainted];	present_stem
1st	emend	"correct, emend, repair; improve, free from errors;"	present_stem
1st	emendic	"beg, solicit, obtain by begging;"	present_stem
2nd	emer	"earn, obtain by service, merit, deserve; emerge; complete/serve out ones time;"	present_stem
3rd	emerg	"rise up out of the water, emerge; escape; appear; arrive;"	present_stem
1st	emic	leap/dash/bolt/jump/spurt/burst/break/shine out; spring/dart/shoot forth/up;	present_stem
1st	emic	|appear suddenly/quickly; make sudden movement up/out; give a jump; stand out;	present_stem
1st	emigr	move out; depart;	present_stem
2nd	emin	"stand out; be prominent/preeminent, excel; project;"	present_stem
3rd	emitt	hurl; let go; utter; send out; drive; force; cast; discharge; expel; publish;	present_stem
4th	emoll	"soften; enervate, mellow;"	present_stem
2nd	emon	exhort; admonish earnestly; warn (Ecc);	present_stem
2nd	emov	"move away, remove, dislodge;"	present_stem
1st	emplastr	bud (trees);	present_stem
4th	emun	fortify; make roads through;	present_stem
1st	emund	"clean thoroughly, free of dirt/impurity; make quite clean (L+S); cleanse/purify;"	present_stem
3rd	emung	"wipe the nose; trick, swindle;"	present_stem
1st	en	swim out;	present_stem
1st	enarr	describe; explain/relate in detail;	present_stem
1st	enat	escape by swimming;	present_stem
1st	enavig	"sail forth/away, put out to sea; sail clear (of obstacles) sail across; swim;"	present_stem
1st	encaeni	consecrate; put on something new;	present_stem
1st	enec	"kill/slay; deprive of life; kill off; exhaust/wear out, plague/torture to death;"	present_stem
1st	enec	"kill/slay; deprive of life; kill off; exhaust/wear out, plague/torture to death;"	present_stem
1st	enerv	"weaken, enervate; make effeminate; deprive of vigor; cut/remove sinews from;"	present_stem
1st	enic	"kill/slay; deprive of life; kill off; exhaust/wear out, plague/torture to death;"	present_stem
1st	enic	"kill/slay; deprive of life; kill off; exhaust/wear out, plague/torture to death;"	present_stem
2nd	enit	shine forth/out; be outstanding/conspicuous;	present_stem
3rd	enitesc	"become bright, gleam; stand out;"	present_stem
1st	enod	make clear;	present_stem
3rd	enub	marry out of ones rank/outside ones community (women); marry and leave home;	present_stem
1st	enubil	make clear;	present_stem
1st	enucle	"take out the kernel/nut, shell; explain in detail;"	present_stem
1st	enumer	"count up, pay out; specify, enumerate;"	present_stem
1st	enunti	"reveal; say; disclose; report; speak out, express, declare;"	present_stem
1st	enunti	"reveal/divulge/make known/disclose; speak out, express/state/assert; articulate;"	present_stem
4th	enutr	"nurture, rear (offspring);"	present_stem
1st	epitom	"abridge, epitomize;"	present_stem
1st	epot	"drink down/up, quaff, drain; absorb; swallow/suck up; empty (vessel); engulf;"	present_stem
1st	epot	"drink down/up, quaff, drain; absorb; swallow/suck up; empty (vessel); engulf;"	present_stem
1st	equit	ride (horseback);	present_stem
3rd	erad	"scrape away/clean/smooth, pare; erase/delete; erase/strike (name in disgrace);"	present_stem
1st	eradic	"root out,eradicate;"	present_stem
3rd	ercisc	divide an inheritance;	present_stem
3rd	erig	"raise, erect, build; rouse, excite, stimulate;"	present_stem
3IO	erip	"snatch away, take by force; rescue;"	present_stem
1st	erog	"pay out, expend;"	present_stem
1st	err	"wander, go astray; make a mistake, err; vacillate;"	present_stem
3rd	eru	"pluck/dig/root up, overthrow, destroy; elicit;"	present_stem
3rd	erubesc	"redden, blush, blush at; blush for shame, be ashamed of;"	present_stem
1st	eruct	bring up noisily; discharge violently;	present_stem
1st	eructu	gush forth;	present_stem
4th	erud	"educate, teach, instruct;"	present_stem
1st	eruder	clear from rubbish;	present_stem
1st	erug	take wrinkles/creases from;	present_stem
3rd	erug	disgorge noisily (food/drink);	present_stem
3rd	erump	burst/pop (abscess/boil); cause (swelling) to burst; become dislocated (limb);	present_stem
3rd	erump	|break out (of); burst/sally/spring/issue forth/out/on; sprout; erupt;	present_stem
3rd	escend	"ascend, go up, mount;"	present_stem
4th	essend	make real; endow with essence;	present_stem
4th	essent	make real; endow with essence;	present_stem
1st	essentific	make real; endow with essence;	present_stem
1st	essoni	"essoin, excuse court absence;"	present_stem
1st	estim	value; estimate;	present_stem
4th	esur	"be hungry, hunger; want to eat, desire food; desire eagerly;"	present_stem
1st	evacu	"empty (vessel); purge, evacuate (bowels);"	present_stem
3rd	evad	"evade, escape; avoid;"	present_stem
1st	evagin	unsheathe;	present_stem
3rd	evalesc	"increase in strength;  prevail, have sufficient strength (to);"	present_stem
3rd	evanesc	vanish/disappear; pass/fade/die (away/out); lapse; become weak/void/forgotten;	present_stem
1st	evangeliz	"preach/declare/proclaim (the Gospel); evangelize, win to Gospel by preaching;"	present_stem
3rd	evann	winnow out; cast out (the chaff from fan leaving the grain);	present_stem
3rd	evanu	become vain/empty/foolish;	present_stem
1st	evast	devastate;	present_stem
3rd	eveh	"carry away, convey out; carry up; exalt; jut out, project;"	present_stem
3rd	evell	pull/pluck/tear/root out;	present_stem
4th	even	come out/about/forth; happen; turn out;	present_stem
4th	even	"it happens, it turns out; come out, come forth;"	present_stem
1st	eventil	winnow thoroughly; fan away; fan (L+S); set in motion (air);	present_stem
1st	everber	beat violently;	present_stem
3rd	everr	sweep/clean out (room/litter); sweep (sea) with dragnet; net (by dragging);	present_stem
3rd	evert	"overturn, turn upside down; overthrow, destroy, ruin;"	present_stem
1st	evigil	be wakeful; watch throughout the night; devise or study with careful attention;	present_stem
3rd	evilesc	become vile/worthless/despicable; cheapen;	present_stem
3rd	evinc	"overcome, conquer, subdue, overwhelm, defeat utterly; prevail, bring to pass;"	present_stem
3IO	evinc	"bind, bind up/around; wind around; wreathe round;"	present_stem
1st	evir	deprive of virility; weaken;	present_stem
1st	eviscer	disembowel; eviscerate;	present_stem
1st	evit	"shun, avoid;"	present_stem
1st	evoc	"call forth; lure/entice out; summon, evoke;"	present_stem
1st	evol	"fly away, fly up/out/forth; rush out/forth;"	present_stem
3rd	evolv	"roll out, unroll; disclose, unfold; extricate; pursue; explain;"	present_stem
3rd	evom	vomit out;	present_stem
1st	evulg	"make public, divulge;"	present_stem
1st	exacerb	"irritate/exasperate, enrage/provoke; aggravate/make worse; grieve, afflict;"	present_stem
3rd	exacerbesc	become irritated/exasperated/angry;	present_stem
3rd	exacu	make sharp or pointed; stimulate;	present_stem
1st	exaedific	"complete the building of, construct;"	present_stem
1st	exaequ	"equalize, make equal; regard as equal; be equal (to);"	present_stem
1st	exaestu	"boil up; seethe, rage;"	present_stem
1st	exagger	"heap up, accumulate; magnify;"	present_stem
1st	exagit	"drive out; stir up, disturb continually, harass; attack, scold, discuss;"	present_stem
1st	exalt	"exalt, elevate, raise; praise; deepen;"	present_stem
1st	examin	"weigh, examine, consider;"	present_stem
1st	exanim	"kill, deprive of life; scare, alarm greatly; tire, exhaust; be out of breath;"	present_stem
1st	exantl	exhaust; endure; bar; suffer much from toil;	present_stem
4th	exaper	disclose; explain; disentangle;	present_stem
1st	exar	plow or dig up; plow; note down (by scratching the wax on the tablets);	present_stem
3rd	exard	kindle; inflame; break out;	present_stem
3rd	exardesc	"flare/blaze up; break out; glow; rage; be provoked, enraged; be exasperated;"	present_stem
3rd	exaresc	dry up;	present_stem
1st	exarm	"disarm, deprive of weapons/arms; weaken, deprive of military strength;"	present_stem
1st	exarm	|dismantle/remove ships tackle; deprive beasts of their natural weapons;	present_stem
1st	exasper	roughen; irritate;	present_stem
1st	exati	"satisfy, satiate; glut;"	present_stem
1st	exauctor	release or dismiss from military service;	present_stem
4th	exaud	"hear clearly; comply with, heed; hear from afar; understand;"	present_stem
4th	exc	rouse; call out send for; summon; evoke;	present_stem
1st	excaec	"blind (completely), confuse/hide/obscure; dull/dim; block channel; de-eye plant;"	present_stem
1st	excalci	remove the shoes from;	present_stem
3rd	excandesc	"catch fire, burst into flame; blaze (w/light); flare up, burn w/rage/anger;"	present_stem
1st	excardin	excardinate; (transfer of cleric to another diocese/consecrated life);	present_stem
1st	excarnific	"torture, punish; torment/torture mentally; hack/cut/tear to pieces (L+S);"	present_stem
1st	excav	"hollow/scoop out, make hollow; produce/make/form by excavation/hollowing out;"	present_stem
3rd	exced	"pass, withdraw, exceed; go away/out/beyond; die;"	present_stem
3rd	excell	be eminent/preeminent; excel;	present_stem
1st	except	"take out, take up; inhale, take (to oneself);"	present_stem
1st	excerebr	"brain, bash the head in; deprive of brains; make senseless; stupefy;"	present_stem
3rd	excerp	pick out; select;	present_stem
3IO	exc	rouse; call out send for; summon; evoke;	present_stem
3rd	excid	"perish; disappear; escape, fall out; be deprived of; lose control of senses;"	present_stem
3rd	excid	"cut out/off/down; raze, destroy;"	present_stem
3rd	excind	"demolish/destroy, raze to ground (town/building); exterminate/destroy (people);"	present_stem
3IO	excip	"take out; remove; follow; receive; ward off, relieve;"	present_stem
1st	excit	"wake up, stir up; cause; raise, erect; incite; excite, arouse;"	present_stem
1st	exclam	"exclaim, shout; cry out, call out;"	present_stem
3rd	exclud	"shut out, shut off; remove; exclude; hinder, prevent;"	present_stem
1st	excogit	"think out; devise, invent, contrive;"	present_stem
3rd	excol	"improve; develop, honor;"	present_stem
1st	excommunic	excommunicate; (exclude Catholic from communion w/faithful);	present_stem
3rd	excoqu	"boil; temper (by heat); boil away; dry up, parch;"	present_stem
1st	excori	"strip of skin/covering; flay, skin, strip;"	present_stem
3rd	excresc	grow out or up; grow up; grow;	present_stem
1st	excruci	torture; torment;	present_stem
1st	excub	sleep/lie in the open/out of doors; keep watch; be attentive;	present_stem
3rd	excud	strike out; forge; fashion; print (Erasmus);	present_stem
1st	exculc	trample down;	present_stem
3rd	exculp	"carve out; erase; (see exsculpo; source Latham, but pre-dates medieval times);"	present_stem
3rd	excurr	run out; make an excursion; sally; extend; project;	present_stem
3rd	excurr	run out; make an excursion; sally; extend; project;	present_stem
1st	excus	excuse/justify/explain; make excuse for/plead as excuse; allege; absolve/exempt;	present_stem
1st	excuss	excuse/justify/explain; make excuse for/plead as excuse; allege; absolve/exempt;	present_stem
3IO	excut	"shake out or off; cast out; search, examine;"	present_stem
1st	exec	"cut out/off; remove/make (hole) by cutting; cut, make cut in; castrate;"	present_stem
3rd	execut	"follow, go after/along; strive after; go on with/persist in; attain/arrive at;"	present_stem
3rd	execut	"|execute, carry out (duty); go through, rehearse; pursue; develop (topic);"	present_stem
3rd	exed	"eat up, consume; hollow;"	present_stem
1st	exempl	adduce/serve as example/model/pattern; form after a pattern;	present_stem
1st	exenter	disembowel;	present_stem
3rd	exer	"stretch forth; thrust out (of land); put out (plant); lay bare, uncover (body);"	present_stem
2nd	exerc	"exercise, train, drill, practice; enforce, administer; cultivate;"	present_stem
1st	exercit	"practice, exercise, train hard, keep at work;"	present_stem
1st	exerr	wander off (from ones course);	present_stem
1st	exert	stretch out; uncover;	present_stem
3IO	exfug	"flee/escape; run/slip/keep away (from), eschew/avoid; baffle, escape notice;"	present_stem
1st	exhal	breathe out; evaporate; die;	present_stem
4th	exhaur	"draw out; drain, drink up, empty; exhaust, impoverish; remove; end;"	present_stem
1st	exhered	disinherit;	present_stem
1st	exheredit	disinherit;	present_stem
2nd	exhib	present; furnish; exhibit; produce;	present_stem
1st	exhilar	"gladden, cheer; brighten, spruce up, enhance appearance;"	present_stem
1st	exhonor	dishonor; despise;	present_stem
2nd	exhorr	shudder; be terrified;	present_stem
